rat5,rat5,rat5,rat4,rat4,,non_app,rat3,rat5,rat5,Student Reviewer,17 Nov 17,," Really enjoying it, but a lot of work! Could do with refurbishment for bathrooms/kitchen 
Spacious rooms Friendly and welcoming!
So many opportunities"
rat4,rat5,rat4,rat3,rat4,,rat3,rat2,rat5,rat5,Student Reviewer,17 Nov 17,, Availability of cooking facilities is poor in accommodation The older years are most supportive and approachable Florey - Queens
rat4,rat4,rat4,rat4,rat4,,non_app,rat4,rat4,rat4,Student Reviewer,17 Nov 17,," Challenging academically 
Learnt a lot of skills, academic/otherwise Careers service work College welfare is good. Sufficient, comfortable but nothing special Vibrant, lots going on Well run, something for everyone"
rat4,rat4,rat5,rat5,rat4,,rat3,rat4,rat4,rat4,Student Reviewer,17 Nov 17,," Lots of careers and networking events Maths institute has very good facilities Most tutors give good feedback, good welfare support. Not much from the SU. College kitchen facilities not so good but room are good"
rat5,rat5,rat5,rat5,rat4,,non_app,rat3,rat4,rat5,Student Reviewer,17 Nov 17,," Lots of careers/internships fairs, careers service, training course opportunities Maths Institute is a great place to learn, work, eat. Loads of libraries. Small tutorials, academic parents, college nurse Don't know much about the SU Onsite at Hertford, kitchens are not great but rooms are nice and internet is fast Any sport/society you can think of, most are heavily subsidised"
rat5,rat5,rat3,rat5,rat4,,rat3,rat5,rat5,rat5,Student Reviewer,17 Nov 17,," Great. Oxford is a great place to live and work. Lots of careers fairs and events from careers office Excellent and innumerable libraries, larger departments Tutorial system can be great for feedback - but depends on tutor I don't interact with OUSU in any way Excellent accommodation and for entirety of course. Not the norm at Oxford, though. Oxford is very convenient everything you want is withing 15 minutes walk Very wide range of societies, both at university and college level"
rat5,rat5,rat5,rat5,rat5,,rat5,rat5,rat5,rat5,Student Reviewer,17 Nov 17,, Very good and diverse
rat4,rat5,rat5,rat5,rat4,,rat3,rat4,rat3,rat4,Student Reviewer,17 Nov 17,," Busy but rewarding Lots of interesting events Modern maths department, excellent facilities Excellent, meet with 3 tutors weekly Provide good speakers but otherwise not used much Jesus College, en suite Decent, everything nearby Good, socials every week"
rat5,rat5,rat4,rat5,rat5,,rat5,rat5,rat4,rat4,Student Reviewer,17 Nov 17,, It's been fun Frequent careers fairs are good I guess Pretty fresh Lots of it Lots of events and stuff quite representative The people are banter - what more could you want Better than Cambridge Good if you enjoy people
rat5,rat5,rat4,rat5,rat4,,rat5,rat4,rat4,rat5,Student Reviewer,17 Nov 17,, Better than Cambridge. The Andrew Wilks Building is exquisite Rowing for life
rat5,rat5,rat5,rat5,rat5,,rat5,rat5,rat5,rat5,Student Reviewer,17 Nov 17,," Better than Cambridge. Love the freebies at career fairs. Better than Cambridge Cafe Pi is my sustenance.
Better than Cambridge. Welfare cookies and tutors give support. Better than Cambridge. Better than Cambridge. Pembroke, MacMillan
""Every time I walk through the door I shed a tear.""
Better than Cambridge. Good. Better than Cambridge. Very legitimate. Better than Cambridge."
rat5,rat4,rat5,rat5,rat5,,rat5,rat5,rat5,rat5,Student Reviewer,17 Nov 17,," It's been really good. I've met some nice people and learnt lots. There are frequent career fairs for each sector Excellent
Cafe Pi is my life Welfare reps are brilliant It's good! My accommodation is like living in my own house Better than Cambridge Clubs are good"
rat5,non_app,rat5,rat5,rat5,,rat5,rat4,rat5,non_app,Student Reviewer,17 Nov 17,," Great tutors and lectures, a lot of activities A lot of libraries, convenient to borrow books Live in St. Hilda's College
The only thing that is not awesome is that we don't have single ensuite inside our room Convenient to buy things and there are lots of facilities"
rat5,rat5,rat4,rat5,rat5,,rat5,rat4,rat5,rat5,Student Reviewer,17 Nov 17,," Having an amazing time! Weekly emails, tutors interested to talk to you So much welfare support Rooms suprisingly big, library and hall great"
rat5,rat5,rat5,rat5,rat5,,non_app,rat5,rat5,non_app,Student Reviewer,17 Nov 17,Sociology MSc," I love it. Much more fun than my undergraduate Plenty of careers events and the careers centre is very helpful Fantastic, both uni and college College allow students to get more help on nightline I have not explored the societies Gadvate college To be honest, I haven't explored that much but what I have seen is amazing. Lots of culture, cafes, things to do I am not part of societies but there are plenty of options"
rat3,rat4,rat4,rat4,rat2,,rat3,rat4,rat3,rat3,Student Reviewer,17 Nov 17,," Careers dept/fairs, talks, presentations etc. Somerville College"
rat4,rat5,rat5,rat4,rat5,,rat3,rat4,rat4,rat4,Student Reviewer,17 Nov 17,, Good uni St Hugh's College
rat4,rat5,rat5,rat5,rat3,,rat4,rat4,rat4,rat5,Student Reviewer,17 Nov 17,, Fantastic
rat5,rat4,rat4,rat5,rat4,,rat3,rat4,rat4,rat5,Student Reviewer,17 Nov 17,," I'm having a great time in Oxford Careers fairs have shown me lots of employers Andrew Wilks building is very new and well equipped (maths dept building) Tutors are great, but I haven't had much contact with personal support I haven't had much contact with them Large well-furnished room but weak WiFi signal Lots of places to go to in the city centre I've had a great time going to a few societies"
rat5,rat3,rat5,rat5,rat4,,rat1,rat5,rat3,rat3,Student Reviewer,17 Nov 17,," Very nice Bad - too much politics, too little actual welfare and outreach My uni accommodation is lovely"
rat4,rat4,rat4,rat4,rat3,,rat2,rat4,rat3,rat3,Student Reviewer,17 Nov 17,, My overall experience has been good. The university offers a careers service with various targeted careers fairs Tutors give reports at the end of every term. Most representation that i know of is organised at a collegiate level. I am not aware of any SU facilities.
rat5,rat5,rat5,rat5,rat1,,non_app,rat5,rat5,rat4,Student Reviewer,17 Nov 17,," Counselling service is appalling.
However subject tutors are great. No idea what they do"
rat4,rat5,rat5,rat5,rat3,,rat3,rat4,rat3,rat4,Student Reviewer,17 Nov 17,English DPhil," A vibrant academic community Lots of personal and career development opportunities Resources and library facilities are unparalleled for my field Lots of platforms for support available, but uni doesn't do much to tackle cause of problems (overwork, resilience etc) Not much experience Expensive! Quite university-centric - results in a ""bubble-like"" atmosphere"
rat2,rat4,rat4,rat5,rat2,,rat3,rat4,rat5,rat3,Student Reviewer,17 Nov 17,," Unrealistic expectations, system may as well have been designed to destroy mental health."
rat4,rat5,rat4,rat5,rat4,,non_app,rat3,rat4,rat4,Student Reviewer,17 Nov 17,, Florey Building
rat4,rat4,rat4,rat3,rat4,,rat3,rat2,rat4,rat4,Student Reviewer,17 Nov 17,," Very positive experience so far, I feel welcomed Some facilities within the accommodation are lacking Florey building, Queen's College - In need of renovation, basic facilities Very good experience at the societies I've joined"
rat4,rat5,rat4,rat5,rat4,,non_app,rat3,rat5,rat5,Student Reviewer,17 Nov 17,," A lot of work not much time to socialise and chill out Work placements are constantly advertised for you, up to you to take them No expense is spared for scientific buildings and equipment :) Used by people so congested but very good Never seen it or had any experience with it Old but good enough, cleaning done for you Beautiful and not too big - difficult to get lost Variety is amazing and usually well-funded too"
rat4,rat5,rat4,rat4,rat4,,rat2,rat4,rat3,rat5,Student Reviewer,17 Nov 17,, Good apart from some buildings have too much asbestos Bureaucratic Close to all relevant facilities Something for everyone
rat4,non_app,rat3,rat4,rat4,,rat2,rat3,rat4,rat4,Student Reviewer,17 Nov 17,," Does a lot of careers stuff, but not much for my subject Tutors pretty good. Very bureaucratic and weighed down by pointless rules and regulations Pretty basic really, don't expect anything great, just somewhere to live A little busy, but the the small businesses are the best. Something for everyone."
rat3,non_app,rat3,rat4,rat3,,non_app,rat3,rat4,rat4,Student Reviewer,17 Nov 17,, I have only been here 4 weeks I don't really think about that yet I don't have much interaction Comfortable
rat4,rat4,rat3,rat4,rat3,,non_app,,rat4,rat4,Student Reviewer,17 Nov 17,Geography and the Environment DPhil," Hard work, lots of free food and drink Yes, no idea Pretty god, Bod libraries are closing early and sometimes difficult to manage There is a counselling service Lives through students, some underground-y clubs There are loads, people are very active"
rat5,rat5,rat4,rat4,rat4,,rat2,rat4,rat5,rat5,Student Reviewer,17 Nov 17,," Excellent Clean, practical, good values for money"
rat4,rat5,rat4,rat5,rat4,,non_app,,rat4,rat3,Student Reviewer,17 Nov 17,," Great access to facilities, thinkers and global speakers. It's good for going from MSc into research, never used careers people Don't know Good choice but some snobbish"
rat5,rat5,rat4,rat4,rat5,,rat3,rat5,rat5,rat5,Student Reviewer,17 Nov 17,Mathematical and Theoretical Physics MSc, Indifferent
rat5,rat5,rat4,rat5,rat3,,rat3,rat4,rat5,rat5,Student Reviewer,17 Nov 17,," Brasenose College
Good, accommodation guaranteed, not cheap but only for 27 weeks
Can choose to live out"
rat4,rat4,rat5,rat5,rat4,,rat3,rat4,rat5,rat4,Student Reviewer,17 Nov 17,," I've had a lot of fun but also experienced lots of stress and panic. Thing are more settled now I'm in 3rd year. There are lots of opportunities but you do have to be proactive Libraries are amazing, sports facilities are okay but too focused on rowing There is a lot of stuff available and most of my tutors have been wonderful, but there are definitely individuals who can be pretty non-supportive The student union isn't something I'm involved in or know anything about Currently in Jowett Walk, really nice but expensive. Was in Balliol, cheaper but kitchens are terrible/non-existent Oxford is a very good size for me, I'm not hugely into clubbing but it has a good range of good shops and public transport and other useful things There are a lot of different ones ranging from fun to serious, to socialising but there's stuff for everyone and creating a society isn't too hard."
rat5,rat5,rat5,rat5,rat5,,non_app,rat4,rat5,rat5,Student Reviewer,17 Nov 17,," Excellent facilities, course sizes are too large Serviceable Lovely quality of life"
rat5,non_app,rat4,rat4,rat4,,rat2,rat4,rat3,rat4,Student Reviewer,17 Nov 17,Politics DPhil, College accommodation good but private renting expensive
rat4,rat5,rat4,rat5,rat4,,rat4,rat3,rat4,rat4,Student Reviewer,17 Nov 17,Politics (European Politics and Society) MPhil, Exceptional libraries Too expensive! (Although St Anne's accommodation is not bad) We need more clubs
rat5,rat5,rat5,rat4,rat5,,rat5,rat5,rat5,rat5,Student Reviewer,17 Nov 17,," Demanding but fruitful Alright, but some facilities could use an upgrade Single en suite"
rat5,rat5,rat4,rat5,rat4,,rat4,rat4,rat5,rat4,Student Reviewer,17 Nov 17,, Cool!
rat5,rat5,rat4,rat5,rat4,,rat2,rat4,rat4,rat5,Student Reviewer,17 Nov 17,," Dope Frequently 3 Awesome Good I don't think of my SU Magdalen Better than 'not so good', worse than 'awesome' Awesome"
rat5,rat5,rat4,rat4,rat4,,non_app,rat4,rat4,rat5,Student Reviewer,17 Nov 17,, Magdalen
rat3,rat5,rat3,rat5,rat3,,non_app,,rat4,rat4,Student Reviewer,17 Nov 17,, Incredibly difficult but quite rewarding Opportunities are fantastic Have everything you could need Tutors are helpful and welfare provisions are numerous Never had any interaction with it Oxford is a great place to live There is something for everyone
rat5,rat5,rat5,rat5,rat5,,rat3,rat5,rat5,rat5,Student Reviewer,17 Nov 17,, Time of my life. The stressful environment is surprisingly rewarding. Loads of careers fairs always running Amazing Lots on offer. Counselling always available easily. Don't know much about it. I live in college -very reasonable price for en suite Awesome if you have time
rat4,rat3,rat4,rat4,rat4,,rat3,rat4,rat4,rat4,Student Reviewer,17 Nov 17,," Stressful but fun and rewarding The career service organised lots of carer related events. However the tutors and teaching staff are not particularly supportive. The facilities in my college and department are good The university-wide and college-wide welfare systems are both very good Not very familiar with specific things they've achieved I live in college accommodation. It's close to my college and very central. Not a big city but lots of things going on Lots of different societies, good opportunities to meet like-minded people"
rat4,rat1,rat3,rat4,rat2,,non_app,rat3,rat2,rat2,Student Reviewer,16 Feb 17,," enjoys going to third year lectures gave up looking varies in quality (2.5) good after comparison with Teddy some tutors are good
what's personal support? never went, what do they (we have one?) do? pretty average city is too far from St Hughs got second place at Valentine puzzle competition"
rat5,rat5,rat4,rat5,rat4,,non_app,rat4,rat5,rat4,Student Reviewer,16 Feb 17,, don't know much about it
rat4,rat4,rat3,rat5,rat4,,rat5,rat4,rat4,rat5,Student Reviewer,16 Feb 17,, fuh!
rat5,rat4,rat4,rat5,rat3,,rat4,rat3,rat5,rat4,Student Reviewer,16 Feb 17,," courses are good, lecturers are mixed not enough yet representation good, facilities none university halls/college accommodation"
rat5,rat5,rat4,rat5,rat3,,rat4,rat3,rat2,rat3,Student Reviewer,16 Feb 17,, music is great!
rat3,rat3,rat3,rat2,rat3,,rat2,rat4,rat3,rat3,Student Reviewer,16 Feb 17,," Libraries are good, but sports facilities are old and inadequate"
rat5,rat3,rat5,rat3,rat5,,rat3,rat5,rat4,rat4,Student Reviewer,16 Feb 17,," challenging but fun, helpful and nice fellow students motivated, friendly and available for questions depends, maths is really good but some others are not - see zoology for example academic support is high, personal I have never asked for
guessing from information must be good too 6 student college owned housing similar to other towns of the size, slightly better as huge number of students depends I guess, the ones I know are friendly and welcoming"
rat4,rat3,rat4,rat5,rat3,,rat4,rat5,rat5,rat3,Student Reviewer,16 Feb 17,Mathematical and Computational Finance MSc," The unis reputation has helped a lot on landing interviews at reputable places and I got my job offer. However, uni doesn't offer much help on the process"
rat4,rat4,rat4,rat3,rat3,,rat4,rat4,rat3,rat5,Student Reviewer,16 Feb 17,, very variable - lots of support out there but can be difficult on academic side halls - nice but expensive
rat4,rat2,rat4,rat3,rat5,,rat3,rat4,rat4,rat5,Student Reviewer,16 Feb 17,," careers department is good, however I feel that within the subject department there is little attempt to develop career skills except those used in an academic career diversity + breadth of options available sports facilities are not good, although they are now building a new sports centre tutor system is amazing - lots of help and support offered and very quickly when needed v. large range and inclusive"
rat4,rat4,rat4,rat4,rat5,,rat3,rat4,rat3,rat4,Student Reviewer,16 Feb 17,," mostly based in work but enjoyable in that fact reminder emails about career service events that seem about weekly detailed material is often provided, challenging and interesting facilities are adequate...would be more interesting to ask, e.g. chem students very supportive, personalised in both academia and personal spheres fair comfortable, sufficient, well located wouldn't really know... welcoming with constant email updates on happenings within societies"
rat4,rat3,rat4,rat4,rat4,,rat3,rat4,rat4,rat4,Student Reviewer,16 Feb 17,," 1st year wasn't great, 2nd and 3rd have been good Careers service isn't great - went for advice last year and they really weren't helpful World-leading lecturers, but not always the best teachers The maths institute is amazing, other facilities aren't so great Solid tutor base, seems to be good support in general Not an active part of most students lives, mostly because of college system Ensuite 1st & 3rd years, decent room in 2nd if antiquated. Kitchen this year has a lot of issues which are yet to be fixed (& no kitchen until 5th year) More going on than there used to be, people aren't always great but city itself is lovely College vibe is good for a lot of different societies"
rat5,rat5,rat3,rat5,rat4,,non_app,rat4,rat4,rat5,Student Reviewer,16 Feb 17,, tennis is great
rat5,rat3,rat4,rat5,rat4,,rat2,rat5,rat5,rat3,Student Reviewer,07 Feb 17,, The tutorial system means I can ask questions and really understand course material. Very spacious and clean with good cooking facilities. The city is beautiful and vibrant.
rat4,rat4,rat5,rat4,rat3,,non_app,rat4,rat5,non_app,Student Reviewer,07 Feb 17,, Nice. Very helpful with emails. Okay.
rat1,rat3,rat3,rat4,rat2,,non_app,rat5,rat5,rat3,Student Reviewer,07 Feb 17,, Lecturers and tutorials are all over the place. Do not correspond. Libraries available for studying everywhere. Simple online resources available. Large en-suit room. Quiet and old. Sometimes quite cold. Nice. Many places to eat out. Activities to do .
rat5,rat5,rat3,rat4,rat2,,rat1,rat2,rat5,rat5,Student Reviewer,07 Feb 17,," Not really, they rely on the individual to seek it out. Very mixed, some great and some poor. Excellent academic facilities. College owned house. Fun, great city. The college clubs are very friendly and relaxed."
rat4,rat2,rat4,rat5,rat2,,non_app,rat4,rat4,rat4,Student Reviewer,07 Feb 17,," Great access to resources, would have liked more dynamic approach to learning. Depends on how much you engage. Good efforts made by the uni but they require you to make efforts too. Access to professors at the top of their field and resources too. Best libraries ever. Academic feedback generally adequate. Personal support very poor. Adequate, lovely house staff. Depends on who you are and what you make of it. Plentiful. Something for everyone. Good social scenes."
rat2,rat4,rat3,rat3,rat4,,rat2,rat3,non_app,rat3,Student Reviewer,07 Feb 17,, Stressful.
rat5,rat3,rat5,rat5,rat3,,non_app,rat4,rat5,rat5,Student Reviewer,07 Feb 17,, Lots of career advice. The tutors are excellent. Counselling is often terrible. Lots of libraries.
rat2,rat2,rat2,rat2,rat1,,rat1,rat1,rat1,rat2,Student Reviewer,07 Feb 17,, Old
rat4,rat2,rat3,rat3,rat2,,rat5,,rat3,rat4,Student Reviewer,07 Feb 17,, Good Good Good Good Good Good Good Good
rat4,rat5,rat4,rat5,rat4,,rat5,rat4,rat3,rat4,Student Reviewer,07 Feb 17,, Close to London:)
rat4,rat4,rat4,rat5,rat2,,rat3,rat5,rat4,rat5,Student Reviewer,31 Jan 17,," greatly enjoyed my time here - huge workload can take its toll sometimes... interesting courses - lectures sometimes not as strong... great (new) maths faculty, good other facilities, e.g. music practice rooms, squash courts, gyms etc tutor support is ok, pastoral college support is not good, friends have led very bad experiences haven't had much interaction with OUSU; at my college they don't have strong representation high quality accommodation provided by college for all 4 years of my degree not a huge city but enough going on - also plenty of nice restaurants in the centre/Cowley! loads of societies, easy to get involved, in my case lots of music - there's tons going on each term"
rat5,rat5,rat4,rat4,rat5,,rat4,rat5,rat4,rat5,Student Reviewer,31 Jan 17,Statistics DPhil," Really good Careers department is excellent, makes up for academic (non-vocational) forms of degrees Lots of facilities in colleges, though central university lacks them Collegiate system is great, lots of points of contact Doesn't really provide facilities but then colleges have those 
Does a lot of under-appreciated work Extremely high standard, reasonable price 
I think this varies by college Oxford isn't the busiest city but there is still plenty going on Excellent range"
rat3,rat3,rat3,rat4,rat4,,rat2,rat4,rat3,non_app,Student Reviewer,31 Jan 17,," depends largely on the workload in each individual term there are career fairs Many of them are wonderfully enthusiastic about their subject and are amongst the top researchers in their field very good libraries, IT services leave a little to be desired some excellent tutoring, personal support is available Don't like the representatives and there are no facilities (college provides these) didn't join any"
rat4,rat4,rat4,rat3,rat4,,rat4,rat5,rat4,rat4,Student Reviewer,31 Jan 17,," Stimulating course, great people, overall happy but some administrative problems careers fairs, workshops very prominent and experienced lectures that know subject well Due to my department building being unavailable for lectures, we have to move to other facilities I'm aware of whom I can contact if I have questions/problems Very happy with my room, spacious and good, quick maintenance Good nightlife, many cultural events like concerts, exhibitions Well organised, many different options"
rat5,rat3,rat4,rat5,rat5,,rat2,rat4,rat4,rat4,Student Reviewer,31 Jan 17,," Hard but rewarding course, lovely city with lots of things to do Fair amount of talks from professionals The lecturers are clearly very bright and know their subject inside out They have everything you could want, even free gym membership Our chaplain knows everyone by name, even if you've never met her. Tutors give extra tuition if you're struggling I never really use it College was a 5, but the second year accommodation, whilst being lovely and big, is a little colder Loads of activities, but sadly the best club (Wahoo) closed recently In college they're wonderful and inclusive, but to join a uni club you have to make more of an effort to find out about it"
rat5,rat4,rat4,rat4,rat2,,rat2,rat3,rat4,rat5,Student Reviewer,31 Jan 17,," I have loved studying and all the extra curricular activity I love the diversity of choice in my course, however, the teaching an support could be improved There is so much you can do and they are all well run"
rat4,rat4,rat3,rat5,rat4,,rat3,rat4,rat4,rat4,Student Reviewer,31 Jan 17,, No tutorials given to maths students in 3rd and 4th year
