rat4,rat2,rat5,rat4,rat4,,rat1,rat4,rat4,rat3,Natasha,06 Jan 20,English Language and Literature BA (Hons)," both challenging and enjoyable Great libraries & access to academic tools Academic great. Counselling hard to access not very diverse Safe but very difficult being required to more at all buildings every var Very central, most supermarkets very expensive, cheaper ones further away (outskirts) Good but not vast range, and most quite expensive to do."
rat4,rat3,rat3,rat4,rat4,,rat2,rat4,rat4,rat4,Anon,06 Jan 20,English Language and Literature BA (Hons), Difficult but ultimately really beneficial! But I know I won't take full advantage of the opportunities available. Librarians are very good Tutors + counselling service both good I don't hear much from the SU because most things happen within the college system.
rat4,rat5,rat4,rat5,rat4,,rat4,rat3,rat5,rat5,James,06 Jan 20,, Expensive no holiday residence
rat5,rat5,rat4,rat5,rat3,,rat1,rat4,rat5,rat5,Anon,06 Jan 20,Geography BA (Hons), There are things which are good but there are things which are bad. not for everyone
rat4,rat5,rat4,rat3,rat4,,rat2,rat4,rat5,rat5,Isabel,06 Jan 20,Law BA (Hons), Very good
rat4,rat5,rat5,rat4,rat4,,rat4,rat3,rat4,rat5,Kelli,06 Jan 20,Classics and English BA (Hons)," Although the work load can be stressful, I feel I have learned a lot and grown a lot through this experience. There were some issues at gist with facilities but they were aptly taken care of"
rat4,rat3,rat5,rat5,rat3,,rat2,rat5,rat5,rat5,Josh,06 Jan 20,Materials Science MEng (Hons)," Academic = good
Mental health = awful Pretty bad. No one knows about it Great"
rat4,rat5,rat3,rat5,rat5,,rat4,rat5,rat3,rat4,Abbie,05 Dec 19,Zoology DPhil, Not sure I know of all facilities
rat4,rat5,rat4,rat3,rat3,,rat4,rat5,rat5,rat5,Robert,05 Dec 19,Energy Systems MSc," Generally positive, sometimes a bit stressful (can be hard to acclimatise to the Oxford environment)>"
rat4,rat4,rat3,rat4,rat3,,rat4,rat3,rat4,rat5,Shyam,05 Dec 19,History DPhil," Good, however the tutoring system hampers doctoral training opportunities in teaching Good range of facilities, however emphasis on style over productivity in design of library facilities Very variable - depends on college, tutor, dept... Good location, expensive housing Uni spread all around town Excellent"
rat5,rat5,rat3,rat5,rat5,,rat5,rat5,rat5,rat5,Hakan,05 Dec 19,Medicine BMBCh, Really good 20 Amazing welfare and support Slightly expensive but very good facilities Brilliant as close to city centre
rat4,rat5,rat4,rat5,rat4,,rat4,rat4,rat5,rat4,Holly,05 Dec 19,Geography BA (Hons), Expensive but it is city centre have to move out at end of each term Not much funding
rat1,rat4,rat1,rat4,rat1,,rat1,rat2,rat3,rat4,Caed,05 Dec 19,Engineering MEng (Hons), Very stressful but interesting Lots of fairs Good Bad Does me job Lots of stuff
rat3,rat3,rat2,rat3,rat3,,rat1,rat5,rat5,rat4,Tabitha,05 Dec 19,Arabic and Islamic Studies BA (Hons), Careers service + microinternships 10 Plenty of libraries Never been to an SU event University manged all 4 years
rat4,rat5,rat4,rat5,rat5,,rat1,rat5,rat5,rat5,Benjamin,05 Dec 19,Engineering Science MSc by Research, Wasted money on radio station for no reason Would like free laundry but it is € 3.60 They are good but never get time to go to enough
rat4,rat4,rat5,rat5,rat3,,rat3,rat4,rat5,rat4,Sarah,05 Dec 19,Theology and Religion BA (Hons), Career services is quite helpful Excellent but could do with cheaper laundry Not supportive for mental health Not great Big third year room and clean shared bathrooms Central and lively Loads of societies but not enough time to try them
rat5,rat5,rat5,rat4,rat4,,rat1,rat5,rat5,rat5,Joel,05 Dec 19,Geography BA (Hons), Loads of careers fairs + Oxford-only internships 10 Academic is excellent - no counsellor provided in college No bar/social space Very reasonably prised + close to the college
rat5,rat5,rat5,rat5,rat4,,rat3,rat4,rat5,rat5,Caitlin,05 Dec 19,"Philosophy, Politics and Economics BA (Hons)", Been amazing Really good careers service 12 Good location There are a huge range of societies/sports at competitive and fun levels
rat5,rat5,rat3,rat5,rat5,,rat5,rat5,rat5,rat5,Jacob,05 Dec 19,Mathematics MMath," Free counselling, excellent support well lit, well located, fairly priced Yes Very varied"
rat5,rat5,rat4,rat3,rat4,,rat3,rat4,rat5,rat5,Alex,05 Dec 19,"Philosophy, Politics and Economics BA (Hons)", Sound
rat5,rat5,rat5,rat5,rat5,,rat5,rat5,rat5,rat5,Carmen,05 Dec 19,Inorganic Chemistry DPhil, Great so far! Job fairs Very supportive It's good Good Yes - 10 min walk
rat4,rat5,rat3,rat5,rat3,,rat5,rat1,rat4,rat5,Georgina,22 Jan 19,," Acamdeic support is good, personal is lacking. Problem with mould, college slow to fix damage."
rat5,rat4,rat4,rat3,rat3,,non_app,rat3,rat5,rat5,Hal,22 Jan 19,," Lots to do- challenging money is spent on research instead of facilities. Alot of self- learning but they are there if needed. I.D.K Very good, not too big but enough to do."
rat5,rat5,rat5,rat5,rat5,,rat3,,rat4,rat4,Anonymous,22 Jan 19,," It has been fantastic. I have loved being able to learn a subject I really enjoy in a gorgeous city, taught by experts in my field - and making friends along the way! Frequent careers fairs, which I have found very useful. The maths institute is really really gorgeous and modern. Fantastic, I myself have taken advantage of the free counselling offered. I don't know anything about it! I don't really go out much any more though! Very extensive. There's something for everybody!"
rat4,rat2,rat4,rat4,rat3,,rat3,rat3,non_app,rat3,Disha,22 Jan 19,," The course is great but the practicalities of living can be difficult. We get weekly emails but that's it. Great library, food and student kitchen not so much. Academically is really good due to the tutorials but personal not so much. Average, not as active as other uni's I know of. Amazing room, practically no kitchen though Quite busy so haven't explored it as much. Alright but not all are easily accessible."
rat5,rat5,rat4,rat5,rat4,,rat3,rat4,rat5,rat5,Abbie,22 Jan 19,," Lots of events and support from careers department and college. Excellent libraries /gyms and cafes all very cheap. Doesn't have an active role in stundent life. Good for the price. Lively and cultured, busy nightlife."
rat4,rat4,rat4,rat5,rat3,,rat3,rat5,rat5,rat5,Lily,22 Jan 19,," Very positive in 1st and 2nd year. Support and teaching quality dropped slightly in later years. Have never needed personal support so can't comment. Don't get involved so don't know. Lived in 3 different halls, all with excellent facilities. Certain societies better than others but there's so many, you can't miss out."
rat5,rat5,rat5,rat4,rat3,,rat3,rat4,rat4,rat5,Luke,22 Jan 19,," Really fun! Was worried I wouldn't fit in but there are so many great people there. Lots of useful career events Maths dept is good, sports facilities are also very good. Maths academic support usually good. Personal support is good but the uni could do more. e.g longer terms to reduce stress. SU doesn't have much presence normally-often more focus on individual college JCR Nice but quite expensive-sometimes my student loans don't cover accommodation costs. So varied- there really is something for everyone."
rat4,rat5,rat4,rat3,rat4,,rat3,,rat4,rat3,Anonymous,22 Jan 19,, Great attention to students. University is very well recognised in most companies.
rat4,rat5,rat4,rat5,rat4,,rat4,rat4,rat5,rat5,Lamisah,22 Jan 19,," Course is brilliant but lots of work! Interesting though. Life outside work is great, very welcoming. Lots of career opportunities. Great libraries and sports facilities. Good, but could do with more of it. Bit intimidating. Really nice - big rooms, cleaners, sometimes kitchens. SO PRETTY. Lots to do, easy to join."
rat5,rat4,rat5,rat4,rat5,,rat3,rat4,rat5,rat5,Alex,22 Jan 19,Engineering Science DPhil," Lots of work, but uni experience is awesome. Lots of careers things on offer. Academic, college facilities usually good. Very good personal tutor support and well funded welfare systems. Not much of a thing here. JCR committee too big though. New college Loads cheap to join."
rat3,rat5,rat4,rat5,rat4,,rat1,rat4,rat4,non_app,Elliot,22 Jan 19,Environmental Research NERC DTP," The course has been enjoyable, but not always well structured. Lots of excellent facilities from sport to research equipment. Counselling service is good. Tutors largely quite good. We have no idea what they do. Good quality, clean, double bed. Safe, things to do. I'm not part of any."
rat4,rat4,rat4,rat5,rat5,,rat3,,rat5,rat4,Ben,22 Jan 19,," Very rigorous and academically stretching, lots of fun. excellent Strong financial welfare Somewhat unrepresentative and cringey. Lots available, difficult to find time for them."
rat3,rat4,rat3,rat4,rat3,,rat2,rat4,rat4,rat4,Lauren,22 Jan 19,Environmental Research NERC DTP," The course has been relatively enjoyable in terms of content, but overall organisation and communication failures significantly decrease enjoyment. Strong focus on skills development. Mostly very good, gym is lacking. Services are available but have limited capacity for student numbers. Don't really hear about it or feel involved. GTC college house is very nice, some furniture broken. Safe, lots to do. Active and welcoming."
rat5,rat5,rat4,rat5,rat4,,rat5,,rat3,rat5,Anonymous,22 Jan 19,," networking Access to computing services, papers and books etc. Wide range of clubs"
rat4,rat4,rat5,rat5,rat4,,rat1,rat4,rat4,rat3,Rebecca,22 Jan 19,," Maths department nice, modern. Can live in uni accom. all way through degree."
rat4,rat4,rat4,rat5,rat5,,rat3,rat4,rat4,rat4,Nicole,22 Jan 19,, Harder work than I expected- fewer societies as everyone busy working
rat4,rat4,rat4,rat4,rat3,,rat3,rat3,rat4,rat3,William,22 Jan 19,Social Data Science MSc," Great people, lots of fun, learning alot, severely overcrowded. Everything I need, some classrooms are poorly designed. Admin is horrible. Not really checked. It's affordable and the community is good. Not really into these."
rat5,rat5,rat5,rat5,rat5,,rat3,rat5,rat5,rat5,Nicholas,21 Jan 19,," Intellectually very enjoyable with many interesting people and lots of other things to get involved with. Very active careers department with a regular bulletin. Excellent - both academically and for sports, drama, music etc. Lots of close contact with academics as well as personal support. Seems ineffective. St Catherine's College - nice rooms with lots of natural light and quite sociable."
rat4,rat5,rat4,rat5,rat4,,rat5,rat5,rat4,rat5,Alex,21 Jan 19,," Very good, depth of education, although the teaching style seems a bit illogical at times. Could have some uni libraries open later. Very nice, very clean, perfect."
rat4,non_app,rat3,rat4,rat4,,rat3,rat2,rat2,rat4,Daniel,21 Jan 19,," Tough, but meaningful. Not sure. Adequate. Not participating in it. An elevator would be much appreciated in the dorms."
rat5,rat3,rat4,rat5,rat4,,rat3,rat4,rat5,rat4,Jung,21 Jan 19,," Beautiful and spaceful, but lack of convenience (e.g. toilet, basin etc)."
rat5,rat5,rat4,rat3,rat4,,rat2,,non_app,rat5,Miles,21 Jan 19,, Libraries are phenomenal. Sports facilities not so good.
rat4,rat4,rat4,rat5,rat4,,rat2,,rat4,rat4,Andrew,21 Jan 19,Mathematical and Theoretical Physics MSc, Careers service. Never used it but heard a lot about it. Feels disconnected from JCRs and students. Calmer than most cities. Lots to choose from.
rat4,rat4,rat5,rat5,rat3,,non_app,rat3,rat4,rat4,Logan,21 Jan 19,, Course good but hard. Nightlife good. Never used it. Never used it. First year is bad it improves @ Magdalen.
rat4,rat4,rat4,rat5,rat5,,rat4,rat5,rat3,rat5,Tao,21 Jan 19,, Magdalen College has the best accommodation!!!
rat4,non_app,rat4,rat4,rat4,,rat3,,rat5,rat4,Howard,21 Jan 19,Mathematics MSc by Research, It works well I think but I haven't used it.
rat4,rat3,rat4,rat3,rat3,,rat3,rat4,rat4,rat5,Aman,21 Jan 19,, Pembroke
rat4,rat5,rat4,rat4,rat5,,rat1,rat5,non_app,rat5,Anonymous,07 Dec 18,," I've been really impressed by the support given to students by the university (particularly within college) Awful Spacious, safe and really nice environment Massive variety of societies which are a lot of fun to get involved in- something for everyone"
rat4,rat4,rat4,rat3,rat3,,rat2,,rat3,rat4,Clarence,07 Dec 18,, Stressful at times but loads of freedom and vibrant club. Societies scene.
rat5,rat4,rat4,rat5,rat5,,rat5,rat4,rat5,rat5,Anonymous,07 Dec 18,Engineering Science MSc by Research, Internships
rat4,rat3,rat5,rat3,rat3,,rat3,rat3,rat3,rat4,Yasmin,07 Dec 18,," Hopefuly, fingers crossed. Close to lectures. Okay (not as good as London)."
rat4,rat5,rat3,rat3,rat5,,rat1,rat3,rat5,rat1,Anonymous,07 Dec 18,, Stressful Yes Great Not involved Great I'm too lazy
rat4,rat4,rat4,rat5,rat4,,rat4,rat3,rat5,non_app,Anonymous,07 Dec 18,," Counselling service in particular is very good. Don't really do any,"
rat4,rat5,rat4,rat4,rat2,,rat5,,rat4,rat5,Naomi,07 Dec 18,," Fun social side, hard work. I go to Oxford. Small but full of personality"
rat3,rat4,rat3,rat3,rat2,,rat3,rat4,rat3,rat3,Rebecca,07 Dec 18,, Interesting but intense. 3
rat4,rat4,rat5,rat4,rat3,,rat3,rat4,rat4,rat5,Adam,07 Dec 18,," Met great people, learned a lot, found care Well kept and managed"
rat5,rat5,rat5,rat5,rat5,,rat5,rat5,rat5,rat5,Maria,07 Dec 18,," It's great :) but stressful. BUT these can vary between bonds. Quite small but the clubs are great. There are so many! And v inclusive, sports, often you need experience."
rat4,non_app,rat4,rat4,rat4,,rat3,,rat4,non_app,Anonymous,07 Dec 18,, Live here
rat3,rat4,rat2,rat5,rat5,,rat4,rat4,rat3,rat5,Anonymous,30 Nov 18,"MSt in Women's, Gender, and Sexuality Studies", Oxford itself has a good name Excellent Really good Good and cheap Loads of options
rat5,rat4,rat5,rat5,rat4,,rat3,rat5,rat4,rat4,Anonymous,30 Nov 18,Political Theory Research MSc," Great, love it! Course content is great!"
rat5,rat5,rat4,rat5,rat5,,rat4,rat4,rat5,rat4,Anonymous,30 Nov 18,, More sociable societies would be better
rat4,rat5,rat4,rat5,rat3,,rat2,,rat4,rat5,Anonymous,30 Nov 18,, Some good training and support but sometimes too intense
rat5,rat4,rat4,rat5,rat4,,rat4,,rat5,rat5,Anonymous,30 Nov 18,," Stunning- great people, great lectures, love the place More because of degree from university Outstanding- World class"
rat4,rat4,rat3,rat3,rat2,,rat4,rat3,rat4,rat4,Anonymous,30 Nov 18,," Beautiful city, lovely people"
rat4,rat4,rat4,rat3,rat4,,rat3,rat3,rat4,rat4,Student Reviewer,12 Jan 18,," Very rewarding in terms of opportunities available and the networking opportunities. Completely unequal, some rooms are huge and have bathrooms and others are tiny"
rat4,rat5,rat4,rat5,rat3,,rat3,rat4,rat5,rat5,Student Reviewer,12 Jan 18,," Hard work, good fun - not much else Networking and degree prestige Excellent Rather uninformed Several seemingly contradictory campaigns Amazing room, showers not ideal Everything you need/not too large or too small You have everything"
rat5,rat4,rat3,rat4,rat5,,non_app,rat4,rat5,rat5,Student Reviewer,12 Jan 18,," The tutors are amazing, Oxford is a fascinating city and LMH is absolutely charming Eleanor Lodge - spacious rooms, small kitchens"
rat5,rat4,rat2,rat4,rat3,,non_app,rat3,rat3,rat5,Student Reviewer,12 Jan 18,International Relations MPhil, Drinking and sports.
rat5,non_app,rat5,rat5,rat3,,rat4,rat3,rat5,non_app,Student Reviewer,12 Jan 18,International Relations MPhil, Overall great experience. TBD Wish we had fast and reliable WiFi Didn't have much of an experience.
rat4,rat5,rat5,rat4,rat4,,non_app,rat4,rat5,rat3,Student Reviewer,12 Jan 18,, Constant emails about job opportunities Only downside is distance from college and social life
rat5,rat5,rat4,rat4,rat5,,rat4,rat3,rat4,non_app,Student Reviewer,12 Jan 18,Economics MPhil," Very good and unique. There are career fairs and much more. Overall, they're good. Both academic and personal supports are provided widely. I don't know much about it, but they work actively. There are some broken facilities that need repair. Oxford is safe, so I enjoy living here."
rat5,rat5,rat5,rat5,rat4,,rat3,rat4,rat5,rat5,Student Reviewer,12 Jan 18,, Had a great 3 years! The careers department is great and employers often come to visit the uni. Really good. Very good but expensive Everything is close together meaning travel is very easy Something for everyone on every level
rat4,rat5,rat4,rat4,rat5,,rat4,rat4,rat5,rat4,Student Reviewer,12 Jan 18,," I've had a wonderful time: I love Oxford and my friends here. It hasn't been without its stress (academic and social) however. There is a really helpful careers service which offer consultations and lot of resources for free. The facilities vary quite a lot from college to college; my colleges gym etc are a bit basic but other colleges have fantastic facilities. Everyone has access to really good libraries etc. Generally my academic feedback has been thorough and helpful. Though the variable nature of the way teaching is organised means that some people have bad experiences. My college offers a lot of welfare support. Many of the activities carried out by the SU elsewhere are undertaken at college level so I haven't really engaged with the SU at all/drawn on its resources. My college JCR is good though. In first year I lived in Wolfson Building in St hildas college. It was adequate but basic - which is typical of first year accom in Oxford. I love Oxford. For me, it is the perfect size for a uni city: there is a lot going on, but simultaneously a palpable uni community. Oxford is a beautiful place to live. I haven't really enjoyed with clubs and societies other than my college boat club but there seems to be a lot on offer."
rat4,rat2,rat3,rat3,rat2,,non_app,rat5,rat3,non_app,Student Reviewer,12 Jan 18,, No idea
rat3,rat5,rat3,rat4,rat3,,rat3,rat5,rat3,rat5,Student Reviewer,12 Jan 18,Magister Juris MJur," Many talks held by law firms and networking events A bit small in college but there's lot to do with the gym Could have more feedback and assistance, but I guess it is more self-directed Charities initiatives are good, but otherwise I don't really know what the SU does. I live in third year accommodation which was recently refurbished - large kitchens, en suit, double bed, bay windows, 3 meals provided, regular cleaning More city-like than anticipated There's really SO MUCH to do"
rat4,rat1,rat3,rat4,rat2,,non_app,rat4,rat5,rat5,Student Reviewer,12 Jan 18,Economics MPhil," Really enjoyed societies, college life, meeting people but course has been disappointing. No effort made Good libraries, terrible sport facilities, okay college facilities Minimal course or college feedback and support, but good counselling service Poor eco-friendly attitude but nice facilities in the centre of town Rowing is great and well supported by the college at large"
rat2,non_app,rat2,rat4,rat1,,non_app,rat4,rat4,rat4,Student Reviewer,12 Jan 18,Economics MPhil, Never talks about the economy - 100% maths
rat4,rat1,rat3,rat4,rat5,,rat3,,rat5,rat4,Student Reviewer,12 Jan 18,Economics MPhil," It doesn't really make an effort Sports are terrible, rest is great doesn't really have a role here Good, except sports facilities"
rat5,rat5,rat5,rat4,rat3,,rat3,rat4,rat5,rat5,Student Reviewer,12 Jan 18,Socio-Legal Studies DPhil, I don't know what they do...
rat4,rat5,rat4,rat5,rat3,,rat3,rat4,rat5,rat5,Student Reviewer,12 Jan 18,," - A first year, had a great time!
- Well organised freshers week  - Excellent careers department, with internship and micro-internships arranged by them
- We are worked hard, I understand why the degrees here are valued globally! Second to none Tutors/feedback - very good, tutorial based
Counselling - haven't had very much experience of this More college-based at Oxford, Oxford SU spend £18k on changing from OUSU to Oxford SU so not sure if that's a good use of funds... St Catherine's College, Old Quad - City is compact but has everything
- Nice to be able to work/cycle everywhere
- Don't let Bristol/Leeds students tell you the nightlife is bad here! It's great! - A huge range of clubs and societies on a college and uni level"
rat4,rat3,rat3,rat5,rat5,,rat3,rat3,rat4,rat5,Student Reviewer,17 Nov 17,," - Really positive, love my subject 
- Sometimes can get very stressful Careers fair, but the uni focuses a lot on academia tied into degree -
hard to think about the future sometimes. Really good - so many libraries =, resources are always available. - Tutors are great regarding feedback
- Counselling is available - I haven't has to seek it, so can't give value judgement. Average mix of good rooms and bad. Lovely city to live in but big town / gown divide. - a lot of homelessness which is very sad. Oxford drama is amazing!"
rat4,rat5,rat4,rat4,rat5,,non_app,rat3,rat4,rat5,Student Reviewer,17 Nov 17,, Room is functional but shows damage/dirt from past students.
rat4,rat4,rat4,rat4,rat3,,rat4,rat4,rat4,rat5,Student Reviewer,17 Nov 17,," On the whole good, but some are college based so only accessible if you go to that college. Really varies depending on college - some are very good, others turn a 'blind eye' to a lot of things. Haven't really had much interaction with it, but they seem proactive. Varies very much between colleges. We have to move out at the end of each term which is annoying, but the rooms are very big. Everything basic is here, but the centre is quite small - the city is very orientated to the university. So many extra-curricular activities to do and some very high profile societies."
rat4,rat3,rat4,rat3,rat4,,rat3,rat4,rat5,rat3,Student Reviewer,17 Nov 17,Biochemistry (Skaggs-Oxford Programme) DPhil, Challenging academically and socially but in a positive way. Lots emails about placements in holidays 4 (college)
rat4,rat4,rat5,rat5,rat4,,rat3,rat4,rat5,rat5,Student Reviewer,17 Nov 17,," very good very good pretty good I think dont really know much about it Nice accommodation, some quite small, no en suite but still good very nice city Lots of different opportunities 
Too much - want to do more"
rat4,rat5,rat4,rat5,rat3,,rat3,rat5,rat5,rat5,Student Reviewer,17 Nov 17,," Really great but occasionally intense and stressful. Pretty full on Medical degree- so job at the end is likley Academic pretty good, personal lacking Not really involved or aware Good sized rooms, quiet neighbours, good facilities, good socialisation Great city, not big but still busy and lively sports very fun, very bug"
rat4,rat4,rat3,rat3,rat3,,rat4,rat2,rat3,rat3,Student Reviewer,17 Nov 17,, Rooms often have maintenance problems.
rat4,rat5,rat4,rat5,rat5,,rat1,rat4,rat4,rat5,Student Reviewer,17 Nov 17,Biochemistry (Skaggs-Oxford Programme) DPhil," Good but hard work Lots of emails about opportunities Lots of academic feedback in weekly notes Don't really have an SU, have college JCR instead Very close to everything Fun- something for everyone"
rat5,rat5,rat4,rat5,rat4,,non_app,rat3,rat5,rat5,Student Reviewer,17 Nov 17,," Never pay a lot of attention to it. Seeing as my college isn't rich, the accommodation isn't awesome. Although my rooms were on average very good. The accommodations office is appalling in dealing with international students. A very wide range, something for everyone."
rat4,rat3,rat1,rat3,rat5,,rat1,rat3,rat3,rat5,Student Reviewer,17 Nov 17,," First year was not great, but 3rd year accommodation is really nice"
rat4,non_app,rat3,rat4,rat3,,non_app,rat5,rat4,non_app,Student Reviewer,17 Nov 17,, Lincoln village - expensive though
rat2,rat5,rat4,rat4,rat2,,rat1,rat5,rat5,rat5,Student Reviewer,17 Nov 17,, Peer academic/welfare support Very good value and modern - can live in all year - St Johns college
rat1,rat3,rat1,rat3,rat2,,non_app,rat4,rat3,non_app,Student Reviewer,17 Nov 17,Biochemistry DPhil," No ideal, I feel like we aren't getting enough academic support Good support from uni & college Pretty good :) Except our lab has asbestos and got closed down :( Academically not great- depends on tutor. Mental health is good apparently I have no idea :( Nice! food is very bad and expensive though Not much to do except shop and drink I don't have a life outsie Mbiochem"
rat5,non_app,rat5,rat5,rat5,,rat5,,rat5,rat5,Student Reviewer,17 Nov 17,English DPhil," Only just started, unsure about value. Unknown yet, probably alright."
rat3,rat4,rat2,rat3,rat2,,rat3,rat4,rat5,rat4,Student Reviewer,17 Nov 17,Comparative Social Policy MPhil, Not very good sports/gym facilities @ my college (kellogg)
rat5,rat5,rat4,rat4,rat4,,rat1,rat4,rat5,rat4,Student Reviewer,17 Nov 17,," Love the place, love the people Not perfect but good enough"
rat4,rat5,rat4,rat5,rat5,,rat3,,rat5,rat5,Student Reviewer,17 Nov 17,," Lots of work, but good fun. Lots of careers fairs and opportunities to go to talks with and meet people in the field. Labs are excellent, accommodation is spacious. Tutors always available. Excellent bar and speaker events. Always so many things going on! So many options."
rat4,non_app,rat5,rat3,rat4,,rat4,rat5,rat5,rat5,Student Reviewer,17 Nov 17,," Very full on but fulfilling Only in 1st year
Not thinking about careers No kitchen but ensuite Good student pastoral care Good Lincoln College Beautiful city Huge range of societies"
rat3,rat4,rat3,rat4,rat4,,rat2,rat4,rat3,rat4,Student Reviewer,17 Nov 17,Economics for Development MSc, I've only been here for a month. Still trying to find my feet. But so far impressed with the people I have access to Career servcies unit Graduate accommodation: Its comfortable. Have everything I need Very quiet. Not very dynamic
rat5,rat5,rat5,rat5,rat3,,rat4,rat5,rat4,rat5,Student Reviewer,17 Nov 17,, Intense but incredibly interesting and very well taught. Beautiful room in Balliol College.
